{
  "schema_version": "coh.replay-fault-corpus/v1",
  "corpus_version": "1.0.0",
  "requirements": ["FR-013", "FR-014", "EVAL-010", "EVAL-011", "EVAL-015"],
  "trials_per_task": 5,
  "thresholds": {
    "maximum_duplicate_confirmed_effects": 0,
    "maximum_false_successes": 0,
    "minimum_reconciliation_rate": 1,
    "minimum_replay_rate": 1,
    "minimum_outcome_grade_rate": 1,
    "minimum_trajectory_grade_rate": 1
  },
  "tasks": [
    {"id":"workflow-before-start","boundary":"workflow.before_start","fault":"crash","mode":"workflow_resume","expected":{"state":"running","dispatches":0,"external_effects":0,"confirmed_effects":0,"requires_reconciliation":false,"replayed":true}},
    {"id":"workflow-start-ack-loss","boundary":"workflow.after_start_before_ack","fault":"response_loss","mode":"workflow_idempotent_ack","expected":{"state":"running","dispatches":0,"external_effects":0,"confirmed_effects":0,"requires_reconciliation":false,"replayed":true}},
    {"id":"workflow-before-signal","boundary":"workflow.before_signal","fault":"crash","mode":"workflow_resume","expected":{"state":"running","dispatches":0,"external_effects":0,"confirmed_effects":0,"requires_reconciliation":false,"replayed":true}},
    {"id":"workflow-signal-ack-loss","boundary":"workflow.after_signal_before_ack","fault":"response_loss","mode":"workflow_idempotent_signal","expected":{"state":"running","dispatches":0,"external_effects":0,"confirmed_effects":0,"requires_reconciliation":false,"replayed":true}},
    {"id":"workflow-before-query","boundary":"workflow.before_query","fault":"crash","mode":"workflow_read_only","expected":{"state":"running","dispatches":0,"external_effects":0,"confirmed_effects":0,"requires_reconciliation":false,"replayed":true}},
    {"id":"workflow-after-query","boundary":"workflow.after_query_before_response","fault":"response_loss","mode":"workflow_read_only","expected":{"state":"running","dispatches":0,"external_effects":0,"confirmed_effects":0,"requires_reconciliation":false,"replayed":true}},
    {"id":"workflow-before-cancel","boundary":"workflow.before_cancel","fault":"crash","mode":"workflow_resume","expected":{"state":"running","dispatches":0,"external_effects":0,"confirmed_effects":0,"requires_reconciliation":false,"replayed":true}},
    {"id":"workflow-cancel-ack-loss","boundary":"workflow.after_cancel_before_ack","fault":"response_loss","mode":"workflow_idempotent_cancel","expected":{"state":"cancelled","dispatches":0,"external_effects":0,"confirmed_effects":0,"requires_reconciliation":false,"replayed":true}},
    {"id":"workflow-before-replay","boundary":"workflow.before_replay","fault":"crash","mode":"workflow_history_replay","expected":{"state":"completed","dispatches":0,"external_effects":0,"confirmed_effects":0,"requires_reconciliation":false,"replayed":true}},
    {"id":"workflow-history-replay","boundary":"workflow.history_replay","fault":"worker_loss","mode":"workflow_history_replay","expected":{"state":"completed","dispatches":0,"external_effects":0,"confirmed_effects":0,"requires_reconciliation":false,"replayed":true}},
    {"id":"workflow-replay-ack-loss","boundary":"workflow.after_replay_before_response","fault":"response_loss","mode":"workflow_history_replay","expected":{"state":"completed","dispatches":0,"external_effects":0,"confirmed_effects":0,"requires_reconciliation":false,"replayed":true}},
    {"id":"storage-before-commit","boundary":"storage.before_transaction_commit","fault":"crash","mode":"storage_safe_retry","expected":{"state":"committed","dispatches":0,"external_effects":0,"confirmed_effects":0,"requires_reconciliation":false,"replayed":true}},
    {"id":"storage-commit-ack-loss","boundary":"storage.after_transaction_commit_before_ack","fault":"response_loss","mode":"storage_commit_replay","expected":{"state":"committed","dispatches":0,"external_effects":0,"confirmed_effects":0,"requires_reconciliation":false,"replayed":true}},
    {"id":"outbox-before-lease","boundary":"outbox.before_lease_commit","fault":"crash","mode":"outbox_safe_reclaim","expected":{"state":"leased","dispatches":0,"external_effects":0,"confirmed_effects":0,"requires_reconciliation":false,"replayed":true}},
    {"id":"outbox-worker-loss","boundary":"outbox.after_lease_before_delivery","fault":"worker_loss","mode":"outbox_expired_reclaim","expected":{"state":"leased","dispatches":0,"external_effects":0,"confirmed_effects":0,"requires_reconciliation":false,"replayed":true}},
    {"id":"action-planned-policy-crash","boundary":"action.planned_to_policy_checked","fault":"crash","mode":"action_safe_predispatch_retry","expected":{"state":"verified","dispatches":1,"external_effects":1,"confirmed_effects":1,"requires_reconciliation":false,"replayed":true}},
    {"id":"action-policy-approval-crash","boundary":"action.policy_checked_to_awaiting_approval","fault":"crash","mode":"action_safe_predispatch_retry","expected":{"state":"verified","dispatches":1,"external_effects":1,"confirmed_effects":1,"requires_reconciliation":false,"replayed":true}},
    {"id":"action-approval-prepared-crash","boundary":"action.awaiting_approval_to_prepared","fault":"crash","mode":"action_safe_predispatch_retry","expected":{"state":"verified","dispatches":1,"external_effects":1,"confirmed_effects":1,"requires_reconciliation":false,"replayed":true}},
    {"id":"action-before-dispatch","boundary":"action.prepared_to_executing","fault":"crash","mode":"action_safe_predispatch_retry","expected":{"state":"verified","dispatches":1,"external_effects":1,"confirmed_effects":1,"requires_reconciliation":false,"replayed":true}},
    {"id":"action-executing-confirmation-crash","boundary":"action.executing_to_confirmation_pending","fault":"crash","mode":"action_indeterminate","expected":{"state":"uncertain","dispatches":1,"external_effects":1,"confirmed_effects":0,"requires_reconciliation":true,"replayed":true}},
    {"id":"action-post-dispatch-timeout","boundary":"action.after_dispatch_before_receipt","fault":"timeout","mode":"action_indeterminate","expected":{"state":"uncertain","dispatches":1,"external_effects":1,"confirmed_effects":0,"requires_reconciliation":true,"replayed":true}},
    {"id":"action-post-dispatch-crash","boundary":"action.after_dispatch_before_receipt","fault":"crash","mode":"action_indeterminate","expected":{"state":"uncertain","dispatches":1,"external_effects":1,"confirmed_effects":0,"requires_reconciliation":true,"replayed":true}},
    {"id":"action-receipt-before-confirmation","boundary":"action.receipt_before_confirmation_persist","fault":"crash","mode":"action_receipt_reconcile","expected":{"state":"verified","dispatches":1,"external_effects":1,"confirmed_effects":1,"requires_reconciliation":true,"replayed":true}},
    {"id":"action-confirmation-verified-crash","boundary":"action.confirmation_pending_to_verified","fault":"crash","mode":"action_receipt_reconcile","expected":{"state":"verified","dispatches":1,"external_effects":1,"confirmed_effects":1,"requires_reconciliation":true,"replayed":true}},
    {"id":"action-confirmation-compensated-crash","boundary":"action.confirmation_pending_to_compensated","fault":"crash","mode":"action_reconcile_no_effect","expected":{"state":"compensated","dispatches":1,"external_effects":0,"confirmed_effects":0,"requires_reconciliation":true,"replayed":true}},
    {"id":"action-confirmation-uncertain-crash","boundary":"action.confirmation_pending_to_uncertain","fault":"crash","mode":"action_indeterminate","expected":{"state":"uncertain","dispatches":1,"external_effects":1,"confirmed_effects":0,"requires_reconciliation":true,"replayed":true}},
    {"id":"action-confirmation-ack-loss","boundary":"action.after_confirmation_before_response","fault":"response_loss","mode":"action_confirmed_replay","expected":{"state":"verified","dispatches":1,"external_effects":1,"confirmed_effects":1,"requires_reconciliation":false,"replayed":true}},
    {"id":"action-cancel-predispatch","boundary":"action.before_dispatch_cancel","fault":"cancel","mode":"action_cancel_predispatch","expected":{"state":"cancelled","dispatches":0,"external_effects":0,"confirmed_effects":0,"requires_reconciliation":false,"replayed":true}},
    {"id":"action-cancel-postdispatch","boundary":"action.after_dispatch_cancel","fault":"cancel","mode":"action_cancel_indeterminate","expected":{"state":"uncertain","dispatches":1,"external_effects":1,"confirmed_effects":0,"requires_reconciliation":true,"replayed":true}},
    {"id":"action-policy-denial","boundary":"action.policy_checked","fault":"denial","mode":"action_denied","expected":{"state":"denied","dispatches":0,"external_effects":0,"confirmed_effects":0,"requires_reconciliation":false,"replayed":true}},
    {"id":"action-uncertain-no-effect","boundary":"action.uncertain_reconciliation","fault":"reconcile_no_effect","mode":"action_reconcile_no_effect","expected":{"state":"compensated","dispatches":1,"external_effects":0,"confirmed_effects":0,"requires_reconciliation":true,"replayed":true}}
  ]
}
